id,title,timestamp,audio_local,image_local,text_local,audio_url,image_url,text_url,analysis,long_prompt
1,Red Stick Figure Under Nazi Shadow,20260324-153718,./sonic_runs/audio/0001-red-stick-figure-under-nazi-shadow-20260324-153718.wav,./sonic_runs/images/0001-red-stick-figure-under-nazi-shadow-20260324-153718.png,./sonic_runs/texts/0001-red-stick-figure-under-nazi-shadow-20260324-153718.txt,https://raw.githubusercontent.com/fraloisio/sonic-runs-assets/main/audio/0001-red-stick-figure-under-nazi-shadow-20260324-153718.wav,https://raw.githubusercontent.com/fraloisio/sonic-runs-assets/main/images/0001-red-stick-figure-under-nazi-shadow-20260324-153718.png,https://raw.githubusercontent.com/fraloisio/sonic-runs-assets/main/texts/0001-red-stick-figure-under-nazi-shadow-20260324-153718.txt,"A red stick figure stands beside a small portrait of a bearded man, while a grayscale silhouette of a man in uniform looms over them. A red banner above reads “Hvordan tror du, det føles at være ung under en krig?” with faint, partially erased handwriting. The composition is layered on a textured, beige surface, suggesting a collage or mixed-media artwork.","Design a soundscape with the rhythmic scrape of a pencil on paper, interspersed with distant, muffled footsteps and a low, ominous drone, all layered over a childlike, hollow whisper that fades into silence."
2,"Forgotten Number, Red Crossed Out",20260324-153801,./sonic_runs/audio/0002-forgotten-number-red-crossed-out-20260324-153801.wav,./sonic_runs/images/0002-forgotten-number-red-crossed-out-20260324-153801.png,./sonic_runs/texts/0002-forgotten-number-red-crossed-out-20260324-153801.txt,https://raw.githubusercontent.com/fraloisio/sonic-runs-assets/main/audio/0002-forgotten-number-red-crossed-out-20260324-153801.wav,https://raw.githubusercontent.com/fraloisio/sonic-runs-assets/main/images/0002-forgotten-number-red-crossed-out-20260324-153801.png,https://raw.githubusercontent.com/fraloisio/sonic-runs-assets/main/texts/0002-forgotten-number-red-crossed-out-20260324-153801.txt,"A black-and-white cutout of a man in uniform holding papers labeled “115” sits against a beige background. Above him, a red banner holds green text fragments reading “Hvorfor?”, “Fremtiden”, and “drab”. Small red X’s mark a tree, a house, and a bird-like shape. The overall composition feels collage-like, with layered textures and symbolic elements.","Design a layered soundscape with gritty paper rustle, a distant ticking clock, a muted choir humming “Fremtiden,” and sudden, sharp red X-sound cuts — spatially panning across a hollow, echoing room with decaying textures and a creeping sense of erased memory."
1,Echoes of Time and Memory,20260324-180332,./sonic_runs/audio/0001-echoes-of-time-and-memory-20260324-180332.wav,./sonic_runs/images/0001-echoes-of-time-and-memory-20260324-180332.png,./sonic_runs/texts/0001-echoes-of-time-and-memory-20260324-180332.txt,https://raw.githubusercontent.com/fraloisio/sonic-runs-assets/main/audio/0001-echoes-of-time-and-memory-20260324-180332.wav,https://raw.githubusercontent.com/fraloisio/sonic-runs-assets/main/images/0001-echoes-of-time-and-memory-20260324-180332.png,https://raw.githubusercontent.com/fraloisio/sonic-runs-assets/main/texts/0001-echoes-of-time-and-memory-20260324-180332.txt,"A collage features four distinct elements: two black-and-white sketches (a profiled couple and children at a chalkboard), a stylized illustration of a clock-topped building labeled “1940–1945,” and a grainy photograph of a seated man in a coat against a brick wall. Text fragments including “håbløs,” “farvel,” and “sann er” are scattered across the beige background, suggesting themes of farewell, hopelessness, and truth.","Create a textured, layered soundscape blending distant ticking clocks, muffled whispers of children in a classroom, and the soft rustle of aged paper, all underpinned by a low, somber cello drone that fades in and out like memory, with occasional sharp metallic clangs echoing like a city’s wartime bells."
2,Whispered Light in the Quiet Dark,20260324-180416,./sonic_runs/audio/0002-whispered-light-in-the-quiet-dark-20260324-180416.wav,./sonic_runs/images/0002-whispered-light-in-the-quiet-dark-20260324-180416.png,./sonic_runs/texts/0002-whispered-light-in-the-quiet-dark-20260324-180416.txt,https://raw.githubusercontent.com/fraloisio/sonic-runs-assets/main/audio/0002-whispered-light-in-the-quiet-dark-20260324-180416.wav,https://raw.githubusercontent.com/fraloisio/sonic-runs-assets/main/images/0002-whispered-light-in-the-quiet-dark-20260324-180416.png,https://raw.githubusercontent.com/fraloisio/sonic-runs-assets/main/texts/0002-whispered-light-in-the-quiet-dark-20260324-180416.txt,"A vintage collage shows a person hunched over, absorbed in work, beside a simple candle illustration. Handwritten Danish phrases float in corners — “Hvorfor lige mig!” and “Lyset for enden af vejen.” The composition feels intimate, textured, and emotionally layered, suggesting solitude or contemplation.","Design a quiet, textured soundscape with a slow heartbeat rhythm and a distant, flickering candle flame — warm, organic, and slightly uncertain — that grows fainter as if carried away by breath or wind, all wrapped in a reverent, acoustic silence."
3,Hands Clasped in Shared Resolve,20260324-181536,./sonic_runs/audio/0003-hands-clasped-in-shared-resolve-20260324-181536.wav,./sonic_runs/images/0003-hands-clasped-in-shared-resolve-20260324-181536.png,./sonic_runs/texts/0003-hands-clasped-in-shared-resolve-20260324-181536.txt,https://raw.githubusercontent.com/fraloisio/sonic-runs-assets/main/audio/0003-hands-clasped-in-shared-resolve-20260324-181536.wav,https://raw.githubusercontent.com/fraloisio/sonic-runs-assets/main/images/0003-hands-clasped-in-shared-resolve-20260324-181536.png,https://raw.githubusercontent.com/fraloisio/sonic-runs-assets/main/texts/0003-hands-clasped-in-shared-resolve-20260324-181536.txt,"Two individuals are seated facing each other, hands clasped in a gesture of collaboration or solidarity. Their expressions suggest focus and mutual effort. The image is a black-and-white collage with torn-paper lettering at the bottom reading “hårdt men nyt sammenhold,” implying resilience and unity. The background is a plain, textured beige surface.","Design a spatial audio scene where two voices—one youthful, one seasoned—overlap in rhythmic syncopation, as if sharing a silent pact; layer in the soft, gritty texture of tearing paper and a low, resonant hum that pulses like steady breaths, grounding the moment in tactile warmth and quiet determination."
